{
  "api_version": "1",
  "request_id": "req_update_01",
  "channel": "stable",
  "version": "0.1.1",
  "minimum_version": "0.1.0",
  "critical": false,
  "published_at": "2026-07-26T08:00:00Z",
  "notes": "Исправления стабильности.",
  "artifacts": [
    {
      "id": "artifact_linux_x64",
      "platform": "linux",
      "arch": "x86_64",
      "size_bytes": 10485760,
      "sha256": "aaaaaaaaaaaaaaaaaaaaaaaaaaaaaaaaaaaaaaaaaaaaaaaaaaaaaaaaaaaaaaaa",
      "signature": "AAAAAAAAAAAAAAAAAAAAAAAAAAAAAAAAAAAAAAAAAAA=",
      "download_url": "/api/client/v1/updates/artifact_linux_x64/download"
    }
  ]
}

